{
  "$schema": "https://json-schema.org/draft/2020-12/schema",
  "$id": "https://github.com/jIRI-san/skalary/schemas/autopilot.schema.json",
  "title": "Autopilot Configuration",
  "description": "Per-project configuration for autonomous plan execution via GitHub Copilot CLI.",
  "type": "object",
  "required": [
    "runtime",
    "copilotAuth",
    "gitProvider",
    "gitAuth",
    "model",
    "context",
    "reasoningEffort",
    "git",
    "timeout",
    "maxIterationsPerStep",
    "build",
    "test"
  ],
  "properties": {
    "runtime": {
      "type": "string",
      "enum": [
        "host",
        "container",
        "sandbox"
      ],
      "description": "Execution runtime. 'host' = git worktree on host. 'container' = Docker container clone-from-remote. 'sandbox' = Windows Sandbox (isolated Win32, disposable)."
    },
    "copilotAuth": {
      "type": "string",
      "enum": ["pat", "oauth"],
      "description": "How the Copilot CLI authenticates for AI requests."
    },
    "gitProvider": {
      "type": "string",
      "enum": ["github", "ado"],
      "description": "Git hosting provider for clone/push/PR operations."
    },
    "gitAuth": {
      "type": "string",
      "enum": ["pat-shared", "oauth", "azure-cli"],
      "description": "How git remote operations authenticate. 'pat-shared' = same PAT as copilotAuth. 'oauth' = GitHub OAuth token. 'azure-cli' = ADO token from az CLI."
    },
    "model": {
      "type": "string",
      "description": "Model identifier for Copilot CLI (e.g. 'gpt-5.6-sol')."
    },
    "context": {
      "type": "string",
      "enum": [
        "default",
        "long_context"
      ],
      "description": "Copilot CLI context window tier."
    },
    "reasoningEffort": {
      "type": "string",
      "enum": [
        "low",
        "medium",
        "high",
        "xhigh",
        "max"
      ],
      "description": "Copilot CLI reasoning effort level."
    },
    "git": {
      "type": "object",
      "required": ["name", "email"],
      "properties": {
        "name": { "type": "string", "description": "Git commit author name." },
        "email": { "type": "string", "description": "Git commit author email." }
      }
    },
    "timeout": {
      "type": "integer",
      "minimum": 1,
      "description": "Maximum execution time per phase in minutes. Host mode enforces this around each Copilot CLI invocation; container mode enforces it inside the entrypoint around each phase."
    },
    "planTimeout": {
      "type": "integer",
      "minimum": 1,
      "description": "Optional whole-run cap in minutes across all phases (container mode). Defaults to 1440 (24h) when absent. Must be >= timeout."
    },
    "maxIterationsPerStep": {
      "type": "integer",
      "minimum": 1,
      "description": "Maximum fix-retry iterations before giving up on a step."
    },
    "build": {
      "type": "string",
      "description": "Build command. Must start with an allowed prefix: dotnet build, dotnet publish, npm run, make, cargo build.",
      "pattern": "^(dotnet build|dotnet publish|npm run|yarn run|pnpm run|make|cargo build|gradle |mvn )"
    },
    "test": {
      "type": "string",
      "description": "Test command. Must start with an allowed prefix: dotnet test, npm test, npm run test, make test, cargo test.",
      "pattern": "^(dotnet test|npm test|npm run test|yarn test|pnpm test|make test|cargo test|gradle test|mvn test)"
    },
    "adoOrg": {
      "type": "string",
      "description": "Azure DevOps organization URL (required if gitProvider=ado)."
    },
    "adoProject": {
      "type": "string",
      "description": "Azure DevOps project name (required if gitProvider=ado)."
    },
    "dockerfileExtensions": {
      "type": "array",
      "items": { "type": "string" },
      "description": "Additional RUN directives appended to base Dockerfile at build time."
    },
    "offlinePackages": {
      "type": "object",
      "required": ["enabled"],
      "description": "Opt-in offline package bundling for the 'container' and 'sandbox' runtimes. When enabled, the host pre-downloads packages into a per-repo/per-branch local feed that is mounted read-only into the runtime and restored fully offline. This resolves a private package stream once on the host (which already has auth) so the disposable container/sandbox never needs stream credentials. Absent or enabled=false preserves current behavior; the 'host' runtime ignores this field.",
      "properties": {
        "enabled": {
          "type": "boolean",
          "description": "Turn offline package bundling on. Default behavior (absent or false) is unchanged."
        },
        "ecosystems": {
          "type": "array",
          "items": { "type": "string", "enum": ["dotnet", "npm"] },
          "description": "Restrict bundling to these ecosystems. Omitted = auto-detect from *.csproj/*.sln (dotnet) and package.json (npm)."
        },
        "maxRebundles": {
          "type": "integer",
          "minimum": 1,
          "default": 3,
          "description": "Maximum host rebundle round-trips before the run stops and surfaces to the user."
        }
      }
    }
  }
}
